Sheet: 1.5 (спутать)
A1: =RAND() -> 0.57524682789286352 | B1: Reversed left context | C1: Reversed center | D1: Left context | E1: Center | F1: Punct | G1: Right context | H1: Title | I1: Author | J1: Birthday | K1: Header | L1: Created | M1: Sphere | N1: Type | O1: Topic | P1: Publication | Q1: Publ_year | R1: Medium | S1: Ambiguity | T1: Full context
A2: =RAND() -> 0.58518548278425642 | B2: ен ыМ уничнок и ценок | C2: меатупс | D2: конец и кончину». Мы не | E2: спутаем | F2: . | G2: Мы знаем: за кончиной не | H2: Галина Шергова. …Об известных всем (2002-2004) | I2: Галина Шергова | J2: 1923 | K2: …Об известных всем | L2: 2002-2004 | M2: публицистика , нехудожественная | N2: мемуары | P2: Г. Шергова. …Об известных всем | Q2: 2004 | R2: книга | S2: омонимия не снята | T2: У Юры была такая строчка: «Не путай конец и кончину». Мы не спутаем. Мы знаем: за кончиной не пришел конец. [Галина Шергова. …Об известных всем (2002-2004)] [омонимия не снята]
A3: =RAND() -> 0.42636815626509783 | B3: янем но мек с огот | C3: латупс | D3: того, с кем он меня | E3: спутал | F3: , | G3: думал дядя Сандро, радуясь, что | H3: Фазиль Искандер. Сандро из Чегема (Книга 1) (1989) | I3: Фазиль Искандер | J3: 1929 | K3: Сандро из Чегема (Книга 1) | L3: 1989 | M3: художественная | N3: роман | P3: Ф. А. Искандер. «Сандро из Чегема». Кн. 1 | Q3: 1989 | R3: книга | S3: омонимия не снята | T3: Не хотел бы я быть на месте того, с кем он меня спутал, думал дядя Сандро, радуясь, что он ― Сандро Чегемский, а не тот человек, с кем его спутал вождь. [Фазиль Искандер. Сандро из Чегема (Книга 1) (1989)] [омонимия не снята]
A4: =RAND() -> 0.60723339425339606 | C4: латупС | E4: Спутал | F4: ― | G4: к счастью, и это многое | H4: Е. М. Мелетинский. Моя тюрьма (1971-1975) | I4: Е. М. Мелетинский | J4: 1918 | K4: Моя тюрьма | L4: 1971-1975 | M4: публицистика , нехудожественная | N4: мемуары | P4: Мелетинский Е. М. Избранные статьи. Воспоминания | Q4: 1998 | R4: книга | S4: омонимия не снята | T4: Спутал ― к счастью, и это многое определило в моей последующей судьбе, в том числе научной. [Е. М. Мелетинский. Моя тюрьма (1971-1975)] [омонимия не снята]
A5: =RAND() -> 0.38256594228685992 | B5: ен мыни мек с ин | C5: ьшеатупс | D5: ни с кем иным не | E5: спутаешь | F5: . | H5: Дина Рубина. Белая голубка Кордовы (2008-2009) | I5: Дина Рубина | J5: 1953 | K5: Белая голубка Кордовы | L5: 2008-2009 | M5: художественная | N5: роман | P5: Дина Рубина. Белая голубка Кордовы | Q5: 2009 | R5: книга | S5: омонимия не снята | T5: Эта рыхловатая жемчужная плоть рубенсовских женщин, она ― как мокрый снег в пейзажах Сислея, ― ни с кем иным не спутаешь. [Дина Рубина. Белая голубка Кордовы (2008-2009)] [омонимия не снята]
A6: =RAND() -> 0.13402372651460848 | B6: дапс йиксечимонокэ йоворим окандо адраиллим | C6: латупс | D6: миллиарда, однако мировой экономический спад | E6: спутал | G6: все карты. | H6: Роман Дорохов. Жизнь с «Понедельника». IBM покупает консалтинговое подразделение одного из «большой четверки» (2002) // «Известия», 2002.07.31 | I6: Роман Дорохов | K6: Жизнь с «Понедельника». IBM покупает консалтинговое подразделение одного из «большой четверки» | L6: 2002 | M6: публицистика , нехудожественная | N6: статья | O6: наука и технологии | P6: «Известия» | Q6: 2002.07.31 | R6: газета | S6: омонимия не снята | T6: Компания собиралась провести в июле первичное размещение акций на биржах и получить 3, 5 миллиарда, однако мировой экономический спад спутал все карты. [Роман Дорохов. Жизнь с «Понедельника». IBM покупает консалтинговое подразделение одного из «большой четверки» (2002) // «Известия», 2002.07.31] [омонимия не снята]
A7: =RAND() -> 0.41810344308707315 | B7: уме ытрак есв окандО | C7: латупс | D7: Однако все карты ему | E7: спутал | G7: Митчелл, который, нарочито не замечая | H7: Денис Быстров. Третий лишний. Президенту Кузину не нашлось места в руководстве ФИБА (2001) // «Известия», 2001.07.09 | I7: Денис Быстров | K7: Третий лишний. Президенту Кузину не нашлось места в руководстве ФИБА | L7: 2001 | M7: публицистика , нехудожественная | N7: статья | O7: спорт | P7: «Известия» | Q7: 2001.07.09 | R7: газета | S7: омонимия не снята | T7: Однако все карты ему спутал Митчелл, который, нарочито не замечая неудачи, не стал покидать вице-президентское кресло. [Денис Быстров. Третий лишний. Президенту Кузину не нашлось места в руководстве ФИБА (2001) // «Известия», 2001.07.09] [омонимия не снята]
A8: =RAND() -> 0.40062799332166499 | B8: янем и йывон ьседз я | C8: алатупс | D8: я здесь новый, и меня | E8: спутала | G8: фамилия, ― ответил один из бандитов | H8: В. П. Катаев. Алмазный мой венец (1975-1977) | I8: В. П. Катаев | J8: 1897 | K8: Алмазный мой венец | L8: 1975-1977 | M8: художественная | N8: роман | P8: Катаев В. Трава забвенья. | Q8: 1997 | R8: книга | S8: омонимия снята | T8: ― Я его пришил по ошибке вместо вас, я здесь новый, и меня спутала фамилия, ― ответил один из бандитов. [В. П. Катаев. Алмазный мой венец (1975-1977)] [омонимия снята]
A9: =RAND() -> 0.19907758932129216 | B9: ротва онтяорѣВ | C9: латупс | D9: Вѣроятно, автор | E9: спутал | G9: с тѣм, что было наканунѣ | H9: C. П. Мельгунов. Мартовскіе Дни 1917 года (1940-1954) | I9: C. П. Мельгунов | J9: 1879 | K9: Мартовскіе Дни 1917 года | L9: 1940-1954 | M9: публицистика, нехудожественная | N9: монография | O9: история, политика и общественная жизнь | P9: Личная библіотека B. Z. http://boomzoomer. livejournal.com | Q9: 1961 | R9: книга | S9: омонимия не снята | T9: Вѣроятно, автор спутал с тѣм, что было наканунѣ, когда, по ея словам, Родзянко нѣсколько раз посѣтил Великаго Князя и говорил ему о регентствѣ. [C. П. Мельгунов. Мартовскіе Дни 1917 года (1940-1954)] [омонимия не снята]
A10: =RAND() -> 0.47150598504044927 | B10: ен Я | C10: юатупс | D10: ― Я не | E10: спутаю | G10: их ни с гарпиями, ни | H10: Дмитрий Емец. Таня Гроттер и магический контрабас (2002) | I10: Дмитрий Емец | J10: 1974 | K10: Таня Гроттер и магический контрабас | L10: 2002 | M10: художественная | N10: роман | P10: Дмитрий Емец. Таня Гроттер и магический контрабас | Q10: 2002 | R10: книга | S10: омонимия не снята | T10: ― Я не спутаю их ни с гарпиями, ни с домовыми, ни с членами команды Тибидохса по драконболу. [Дмитрий Емец. Таня Гроттер и магический контрабас (2002)] [омонимия не снята]
A11: =RAND() -> 0.83333703176411178 | B11: ыт обил 2 V 61 | C11: алатупс | D11: 16/V ― № 2; либо ты | E11: спутала | G11: нумерацию, либо четыре письма потерялись | H11: Юлий Даниэль. Письма из заключения (1966-1970) | I11: Юлий Даниэль | J11: 1925 | K11: Письма из заключения | L11: 1966-1970 | M11: бытовая , нехудожественная | N11: письмо личное | O11: частная жизнь | P11: Юлий Даниэль. «Я всё сбиваюсь на литературу…» Письма из заключения. Стихи | Q11: 2000 | R11: книга | S11: омонимия не снята | T11: Так, на твоем, Ларка, письме от 30/V (последнем) стоит № 7, а на предыдущем, от 16/V ― № 2; либо ты спутала нумерацию, либо четыре письма потерялись. [Юлий Даниэль. Письма из заключения (1966-1970)] [омонимия не снята]
A12: =RAND() -> 0.92251443106452324 | B12: но локорп нидо окьлоТ | C12: латупс | D12: ― Только один прокол ― он | E12: спутал | G12: пол ребенка. | H12: Юлиан Семенов. Семнадцать мгновений весны (1968) | I12: Юлиан Семенов | J12: 1931 | K12: Семнадцать мгновений весны | L12: 1968 | M12: художественная | N12: роман | R12: книга | S12: омонимия не снята | T12: ― Только один прокол ― он спутал пол ребенка. [Юлиан Семенов. Семнадцать мгновений весны (1968)] [омонимия не снята]
A13: =RAND() -> 0.88756519761585939 | B13: и илибс ёсв еыроток автсьлетяотсбо | C13: илатупс | D13: обстоятельства, которые всё «сбили и | E13: спутали | F13: », | G13: как пишет об этом Михаил | H13: Е. Душечкина, Л. Берсенева. Три века русской ёлки // «Наука и жизнь», 2008 | I13: Е. Душечкина, Л. Берсенева | K13: Три века русской ёлки | L13: 2008 | M13: публицистика , нехудожественная | N13: статья | O13: история | P13: «Наука и жизнь» | Q13: 2008 | R13: журнал | S13: омонимия не снята | T13: В первые годы после революции никаких специальных мер, направленных на запрет ёлки, действительно не предпринималось, а если она и стала в это время чрезвычайной редкостью, то причиной тому были внешние обстоятельства, которые всё «сбили и спутали», как пишет об этом Михаил Булгаков в романе «Белая гвардия», повествуя о событиях кануна 1919 года: [Е. Душечкина, Л. Берсенева. Три века русской ёлки // «Наука и жизнь», 2008] [омонимия не снята]
A14: =RAND() -> 0.57891396413333185 | B14: есв лешан ен уксипаз яиненлов | C14: латупс | D14: волнения записку не нашел, все | E14: спутал | G14: и опозорился. | H14: Михаил Гиголашвили. Чертово колесо (2007) | I14: Михаил Гиголашвили | J14: 1954 | K14: Чертово колесо | L14: 2007 | M14: художественная | N14: роман | P14: М. Гиголашвили. Чертово колесо | Q14: 2009 | R14: книга | S14: омонимия не снята | T14: Немецкого языка онкель не знал, учил весь вечер, что по-немецки «кашель» будет «хустен», даже записал на листок, а у доктора от волнения записку не нашел, все спутал и опозорился. [Михаил Гиголашвили. Чертово колесо (2007)] [омонимия не снята]
A15: =RAND() -> 0.71322860162303225 | B15: ен отч аз ин хИ | C15: ьшеатупс | D15: Их ни за что не | E15: спутаешь | G15: благодаря фамильным чертам в передней | H15: Владимир Соловьев. Наслаждаясь открытым небом (2004) // «За рулем», 2004.03.15 | I15: Владимир Соловьев | K15: Наслаждаясь открытым небом | L15: 2004 | M15: публицистика , нехудожественная | N15: статья | O15: техника | P15: «За рулем» | Q15: 2004.03.15 | R15: журнал | S15: омонимия не снята | T15: Их ни за что не спутаешь благодаря фамильным чертам в передней части кузова, салоне, собственным силовым агрегатам. [Владимир Соловьев. Наслаждаясь открытым небом (2004) // «За рулем», 2004.03.15] [омонимия не снята]
A16: =RAND() -> 0.62634123439107015 | B16: ен ежот монамьлепиЦ мосепоМ с | C16: ьшеатупс | D16: с Мопесом Ципельманом тоже не | E16: спутаешь | F16: . | H16: Андрей Белянин. Свирепый ландграф (1999) | I16: Андрей Белянин | J16: 1967 | K16: Свирепый ландграф | L16: 1999 | M16: художественная | N16: роман | P16: Андрей Белянин. Свирепый ландграф | Q16: 1999 | R16: книга | S16: омонимия не снята | T16: С морозу не выговоришь, но и с Мопесом Ципельманом тоже не спутаешь. [Андрей Белянин. Свирепый ландграф (1999)] [омонимия не снята]
A17: =RAND() -> 0.99808622848455286 | B17: меьневбаз отч или онлопен и | C17: латупс | D17: и неполно или что забвеньем | E17: спутал | F17: , | G17: и ты, земляк мой, архангельский | H17: Б. В. Шергин. От автора. Запечатленная слава (1950-1960) | I17: Б. В. Шергин | J17: 1893 | K17: От автора. Запечатленная слава | L17: 1950-1960 | M17: художественная | N17: очерк | P17: Борис Шергин. Повести и рассказы | Q17: 1987 | R17: книга | S17: омонимия не снята | T17: Если я рассказал мало и неполно или что забвеньем спутал, и ты, земляк мой, архангельский помор, исправь и дополни. [Б. В. Шергин. От автора. Запечатленная слава (1950-1960)] [омонимия не снята]
A18: =RAND() -> 0.42066528487623089 | B18: оньлетазябО тежюс еокат отч тужакс | C18: тюатупс | D18: скажут, что такое сюжет. Обязательно | E18: спутают | G18: с фабулой. Писатели всегда путают | H18: Юрий Коваль. Веселье сердечное (1980-1993) | I18: Юрий Коваль | J18: 1938 | K18: Веселье сердечное | L18: 1980-1993 | M18: художественная | N18: рассказ | P18: Юрий Коваль. Опасайтесь лысых и усатых | Q18: 1993 | R18: книга | S18: омонимия не снята | T18: Пускай писатели скажут, что такое сюжет. Обязательно спутают с фабулой. Писатели всегда путают сюжет с фабулой. [Юрий Коваль. Веселье сердечное (1980-1993)] [омонимия не снята]
A19: =RAND() -> 0.53157744741746416 | B19: авонамхА и вохаН | C19: илатупс | D19: Нахов и Ахманова | E19: спутали | G19: class и classic. | H19: В. В. Бибихин. Алексей Федорович Лосев. Записи 1970-1973 (1970-1974) | I19: В. В. Бибихин | J19: 1938 | K19: Алексей Федорович Лосев. Записи 1970-1973 | L19: 1970-1974 | M19: учебно-научная, нехудожественная | N19: дневник, записные книжки | P19: В. В. Бибихин. Алексей Федорович Лосев. Сергей Сергеевич Аверинцев | Q19: 2006 | R19: книга | S19: омонимия не снята | T19: Нахов и Ахманова спутали class и classic. [В. В. Бибихин. Алексей Федорович Лосев. Записи 1970-1973 (1970-1974)] [омонимия не снята]
A20: =RAND() -> 0.52757004563373133 | B20: окьлоТ иизанмиг ароткерид аныс ушаС | C20: алатупс | D20: Сашу, сына директора гимназии. Только | E20: спутала | G20: сначала маму с Аней. Две | H20: З. И. Воскресенская. Сердце матери (1963-1965) | I20: З. И. Воскресенская | J20: 1907 | K20: Сердце матери | L20: 1963-1965 | M20: художественная | N20: повесть | P20: Воскресенская З. И. Сердце матери | Q20: 1986 | R20: книга | S20: омонимия не снята | T20: В барышне-крестьянке она сразу угадала Олину подружку Сашу Щербо, в Дон Кихоте ― Митиного приятеля Алешу Яковлева и, конечно, узнала в маленьком гноме пятилетнего Сашу, сына директора гимназии. Только спутала сначала маму с Аней. Две тоненькие елочки, закутанные в зеленую бахрому, танцевали лучше всех, но у мамы-елочки из-под зеленой шляпы выбилась белая прядь волос. [З. И. Воскресенская. Сердце матери (1963-1965)] [омонимия не снята]
A21: =RAND() -> 0.69873445668986367 | B21: амиТ ясливиду гом ен какин | C21: илатупС | D21: никак не мог, ― удивился Тима. ― | E21: Спутали | G21: меня с кем-то, наверное». Действительно | H21: Лев Дворецкий. Шакалы (2000) | I21: Лев Дворецкий | J21: 1927 | K21: Шакалы | L21: 2000 | M21: художественная | N21: роман | P21: Лев Дворецкий. Шакалы | Q21: 2000 | R21: книга | S21: омонимия не снята | T21: «Сергеева могли повысить в звании, но уж ждать меня сегодня, в этот час, он никак не мог, ― удивился Тима. ― Спутали меня с кем-то, наверное». Действительно, Сергеев Владимир Максимович только что вступил в новую должность в новом чине полковника. [Лев Дворецкий. Шакалы (2000)] [омонимия не снята]
A22: =RAND() -> 0.56181782095099475 | B22: отэ ондо ежу и ьтижолто | C22: олатупс | D22: отложить, — и уже одно это | E22: спутало | G22: все планы уборочной. | H22: Федор Абрамов. Братья и сестры (1958) | I22: Федор Абрамов | J22: 1920 | K22: Братья и сестры | L22: 1958 | M22: художественная | N22: роман | P22: Ф. Абрамов. Братья и сестры | Q22: 1982 | R22: книга | S22: омонимия не снята | T22: Травостой на некоторых речках из-за поздней весны оказался так мал, что выезд на них пришлось отложить, — и уже одно это спутало все планы уборочной. [Федор Абрамов. Братья и сестры (1958)] [омонимия не снята]
A23: =RAND() -> 0.53768553416430143 | B23: ямерв еоротокен зереч а ялбмасна | C23: илатупс | D23: ансамбля, а через некоторое время | E23: спутали | G23: подлинный с купленным и не | H23: Д. С. Лихачев. Заметки о русском (1984) | I23: Д. С. Лихачев | J23: 1906 | K23: Заметки о русском | L23: 1984 | M23: учебно-научная , нехудожественная | N23: статья | O23: наука и технологии, культурология | P23: Лихачев Д. С. Избранные работы в трех томах. Том 2 | Q23: 1987 | R23: книга | S23: омонимия не снята | T23: Купили книжный шкаф точно такой, как и подлинный, купили для ансамбля, а через некоторое время спутали подлинный с купленным и не знают, какой из двух принадлежал владельцу мемориальной квартиры. [Д. С. Лихачев. Заметки о русском (1984)] [омонимия не снята]
A24: =RAND() -> 0.61837711201913059 | B24: акбаБ | C24: алатупс | D24: Бабка | E24: спутала | G24: Антона с Николаем Леонидовичем, своим | H24: Александр Чудаков. Ложится мгла на старые ступени (1987-2000) // «Знамя», 2000 | I24: Александр Чудаков | J24: 1938 | K24: Ложится мгла на старые ступени | L24: 1987-2000 | M24: художественная | N24: роман | P24: «Знамя» | Q24: 2000 | R24: журнал | S24: омонимия не снята | T24: Бабка спутала Антона с Николаем Леонидовичем, своим старшим сыном, который жил в Саратове и тоже должен был приехать. [Александр Чудаков. Ложится мгла на старые ступени (1987-2000) // «Знамя», 2000] [омонимия не снята]
A25: =RAND() -> 0.15425023706081564 | B25: ен оге отч каТ | C25: ьшеатупс | D25: Так что его не | E25: спутаешь | G25: ни с кем. | H25: Евгений Сухов. Делу конец -- сроку начало (2007) | I25: Евгений Сухов | J25: 1959 | K25: Делу конец -- сроку начало | L25: 2007 | M25: художественная | N25: роман | P25: Е. Е. Сухов. Делу конец -- сроку начало | Q25: 2007 | R25: книга | S25: омонимия не снята | T25: Так что его не спутаешь ни с кем. [Евгений Сухов. Делу конец -- сроку начало (2007)] [омонимия не снята]

Sheet: 1.4 (спутать)
A3: Названия строк | B3: Количество по полю Center
A4: C. П. Мельгунов | B4: 2
A5: А. А. Игнатьев | B5: 1
A6: Александр Иличевский | B6: 1
A7: Александр Чудаков | B7: 1
A8: Александра Маринина | B8: 2
A9: Андрей Белянин | B9: 1
A10: Б. В. Шергин | B10: 1
A11: В. В. Бибихин | B11: 1
A12: В. П. Катаев | B12: 1
A13: Валерий Любин | B13: 1
A14: Василий Аксенов | B14: 1
A15: Василий Катанян | B15: 1
A16: Вениамин Смехов | B16: 1
A17: Виктор Пронин | B17: 1
A18: Виктор Розов | B18: 1
A19: Владимир Соловьев | B19: 1
A20: Владислав Отрошенко | B20: 1
A21: Г. В. Адамович | B21: 1
A22: Галина Шергова | B22: 1
A23: Д. С. Лихачев | B23: 1
A24: Денис Быстров | B24: 1
A25: Дина Рубина | B25: 1
A26: Дмитрий Емец | B26: 1
A27: Е. Душечкина, Л. Берсенева | B27: 2
A28: Е. М. Мелетинский | B28: 1
A29: Евгений Сухов | B29: 1
A30: Еремей Парнов | B30: 1
A31: З. И. Воскресенская | B31: 1
A32: коллективный | B32: 1
A33: Лариса Васильева | B33: 1
A34: Лев Дворецкий | B34: 1
A35: Михаил Гиголашвили | B35: 1
A36: Михаил Тырин | B36: 1
A37: Н. Леонов, А. Макеев | B37: 1
A38: Надежда Мандельштам | B38: 1
A39: Олег Трояновский | B39: 1
A40: Роберт Штильмарк | B40: 1
A41: Роман Дорохов | B41: 1
A42: С. Гедройц | B42: 1
A43: Стас Тыркин | B43: 1
A44: Фазиль Искандер | B44: 1
A45: Федор Абрамов | B45: 1
A46: Ю. М. Нагибин | B46: 1
A47: Юлиан Семенов | B47: 1
A48: Юлий Даниэль | B48: 1
A49: Юрий Коваль | B49: 1
A50: Общий итог | B50: 49

Sheet: 1.5 (перепутать)
A1: =RAND() -> 0.66183492343151773 | B1: Reversed left context | C1: Reversed center | D1: Left context | E1: Center | F1: Punct | G1: Right context | H1: Title | I1: Author | J1: Birthday | K1: Header | L1: Created | M1: Sphere | N1: Type | O1: Topic | P1: Publication | Q1: Publ_year | R1: Medium | S1: Ambiguity | T1: Full context
A2: =RAND() -> 0.653163413421602 | B2: есв ано оН | C2: алатупереп | D2: Но она все | E2: перепутала | G2: и положила цветы на колени | H2: Ирина Полянская. Прохождение тени (1996) | I2: Ирина Полянская | J2: 1969 | K2: Прохождение тени | L2: 1996 | M2: художественная | N2: роман | P2: Полянская И. Прохождение тени | Q2: 1999 | R2: книга | S2: омонимия не снята | T2: Но она все перепутала и положила цветы на колени Теймуразу. [Ирина Полянская. Прохождение тени (1996)] [омонимия не снята]
A3: =RAND() -> 0.88460691345798992 | B3: ястежак анО | C3: алатупереп | D3: Она, кажется, | E3: перепутала | G3: время и дожидается, сложив на | H3: В. Лихоносов. Ненаписанные воспоминания. Наш маленький Париж. Ч. 5 (1983) | I3: В. Лихоносов | J3: 1936 | K3: Ненаписанные воспоминания. Наш маленький Париж. Ч. 5 | L3: 1983 | M3: художественная | N3: роман | P3: В. И. Лихоносов. Ненаписанные воспоминания. Наш маленький Париж | Q3: 1987 | R3: книга | S3: омонимия не снята | T3: Она, кажется, перепутала время и дожидается, сложив на подоконнике руки, когда стемнеет? [В. Лихоносов. Ненаписанные воспоминания. Наш маленький Париж. Ч. 5 (1983)] [омонимия не снята]
A4: =RAND() -> 0.87032692548471502 | B4: еинавориднумбо еонневтсечакен иимра йоксрац лялватсоп | C4: латупереп | D4: поставлял царской армии некачественное обмундирование) | E4: перепутал | G4: с сокровищами Трои (найденный им | H4: Афиша (1997) // «Столица», 1997.04.01 | K4: Афиша | L4: 1997 | M4: публицистика , нехудожественная | N4: обзор | O4: досуг, зрелища и развлечения | P4: «Столица» | Q4: 1997.04.01 | R4: журнал | S4: омонимия не снята | T4: Найдите наконец 50 тысяч и час-полтора времени и взгляните на золотые украшения, которые археолог-дилетант (россиянам известный еще и тем, что поставлял царской армии некачественное обмундирование) перепутал с сокровищами Трои (найденный им клад был зарыт на тысячу лет раньше, чем троянцы и ахейцы не поделили Прекрасную Елену). [Афиша (1997) // «Столица», 1997.04.01] [омонимия не снята]
A5: =RAND() -> 0.97661184707893689 | B5: и ламолоп юлмез ан яслишурбо | C5: латупереп | D5: обрушился на землю, поломал и | E5: перепутал | G5: все, лишил людей пространственно-временных координат | H5: Александр Зиновьев. Русская судьба, исповедь отщепенца (1988-1998) | I5: Александр Зиновьев | J5: 1922 | K5: Русская судьба, исповедь отщепенца | L5: 1988-1998 | M5: публицистика , нехудожественная | N5: мемуары | P5: А. А. Зиновьев. Русская судьба, исповедь отщепенца | Q5: 1999 | R5: книга | S5: омонимия не снята | T5: Ощущение было такое, будто какой-то страшный ураган обрушился на землю, поломал и перепутал все, лишил людей пространственно-временных координат. [Александр Зиновьев. Русская судьба, исповедь отщепенца (1988-1998)] [омонимия не снята]
A6: =RAND() -> 0.18328133829586424 | B6: ёсв есв отч ьсолинсяыв гурдв | C6: илатупереп | D6: вдруг выяснилось, что все всё | E6: перепутали | F6: , | G6: то ли Света все перепутала | H6: Алексей Макушинский. Город в долине (2012) | I6: Алексей Макушинский | J6: 1960 | K6: Город в долине | L6: 2012 | M6: художественная | N6: роман | P6: Алексей Макушинский. Город в долине | Q6: 2013 | R6: книга | S6: омонимия не снята | T6: Недели за две до моего и за неделю до их отъезда вдруг выяснилось, что все всё перепутали, то ли Света все перепутала (что вообще-то было на нее не похоже), то ли Двигубский все перепутал, то ли я их понял неправильно, и что дом, куда мы должны были ехать, вовсе никакой не дом, но ― квартира, и находится она не возле Лукки, но гораздо южнее,за Ливорно, чуть-чуть не доезжая до Гроссетто, в местности, называемой Маремма (название, сказал мне Двигубский, как будто из какого-то сна…), в местечке с не менее пленительным названием Кастильоне делла Пескайя, до которого я добирался, я помню, почти двое суток, заночевав в Вероне с ее знаменитым амфитеатром и пресловутым балконом Джульетты, добычей туристских толп, наседающих друг на друга в неизменном своем обалдении. [Алексей Макушинский. Город в долине (2012)] [омонимия не снята]
A7: =RAND() -> 0.72253043181581433 | B7: екшепс в умеом-оп цензук окьлоТ | C7: латупереп | D7: Только кузнец по-моему в спешке | E7: перепутал | G7: подковы. | H7: Борис Левин. Блуждающие огни (1995) | I7: Борис Левин | J7: 1938 | K7: Блуждающие огни | L7: 1995 | M7: художественная | N7: роман | P7: Борис Левин. Инородное тело. Автобиографическая проза и поэзия | Q7: 2002 | R7: книга | S7: омонимия не снята | T7: ― Только кузнец по-моему в спешке перепутал подковы. [Борис Левин. Блуждающие огни (1995)] [омонимия не снята]
A8: =RAND() -> 7.3478881189467771E-2 | B8: есв ыв адопсог уссерп юукснитнегра | C8: илатупереп | D8: аргентинскую прессу: господа , вы все | E8: перепутали | F8: , | G8: знаменитый советский писатель ― это мой | H8: Василий Аксенов. Таинственная страсть (2007) | I8: Василий Аксенов | J8: 1932 | K8: Таинственная страсть | L8: 2007 | M8: художественная | N8: роман | P8: Аксенов В. П. Таинственная страсть. Роман о шестидесятниках | Q8: 2009 | R8: книга | S8: омонимия не снята | T8: Розовый дворец и гарцующие вокруг президентские кавалергарды; аргентинская переводчица княжна Мышкина, высокая, чуть сутуловатая девушка ― отпрыск Добровольческой армии, которую расхристанные журналисты принимали за советскую кинозвезду; караван фестиваля, несущийся через выжженную солнцем пампу, в которой то и дело возникают гигантские строения рекламных сигаретных пачек; накат океана, выгнутая дугой полоса отелей, толпы фанатиков кино в шортах и купальниках, плывущая над толпой на крыше автобуса дочь,мать , сестра и супруга аргентинских трудящихся, суперактриса по имени Ла Бомба, можете к этому имени прибавить то, что вам рисует воображение, а Ваксона и Ливана, можно надеяться, оно не подведет; ковровая дорожка фестиваля, по которой мы следуем вслед за американцами по латинскому алфавиту, вот оборачивается на подъеме по лестнице противоположность крутобедрой и высокогрудой Ла Бомбы, девушка Дальнего Запада соломенногривая Элизабет Сазерлэнд, а вслед за ней движется длиннорукий и быковатый кинозлодей Чак Паланс (он же по рождению Остап Охрименко), умеющий стоять на одной ладони, держа свое мощное тело параллельно земле: ночь триумфа для Орсона Уэллса, доставившего сюда ленту по мотивам романа Кафки «Процесс» с Роми Шнайдер в главной женской роли, ошеломленные зрители в смежных кафе гудят до утра, а мы не можем так гудеть, потому что у нас не хватает песо даже на пиво; фольклорные праздники народов латино, на которых каждый раз побеждает огромный мексиканский петух с гитарой в окружении коротконогих курочек с трубами; Виктор Степаныч Сытский, играющий роль «чеховского интеллигента», окруженного молодыми агентами КГБ Ливаном, Ваксоном и Эдуардо, дает пресс-конференцию на фестивале, «агенты» хохочут, слушая глубоко партийные речи «Парткомыча», и тут знаменитый итальянский писатель Васко Пратолини встает и просвещает провинциальную аргентинскую прессу: господа , вы все перепутали, знаменитый советский писатель ― это мой почти тезка синьор Ваксон, именно вот этот молодой человек, чей протестный роман только что вышел у нас в Италии, а вот товарища Сытского у нас даже в компартии никто не знает; Сытский на грани нервного приступа бегает по набережным, пытается собрать всех в кучу ― товарищи, товарищи, вы что, не видите, какая вокруг сложная обстановка, ведь мы окружены врагами; вот парадокс, тут оказывается, масса русских, иной раз на пляже прислушаешься ― то тут, то там говорят по-русски ― «Вера Николаевна, а почему бы нам летом, в январе, не поехать в Европу?» [Василий Аксенов. Таинственная страсть (2007)] [омонимия не снята]
A9: =RAND() -> 0.44874249480902773 | B9: адгесв как икинахем ех-еХ | C9: илатупереп | D9: Хе-хе, механики, как всегда, | E9: перепутали | G9: клапана, подмешалась морская вода… Пользуясь | H9: К. С. Бадигин. Секрет государственной важности (1974) | I9: К. С. Бадигин | J9: 1910 | K9: Секрет государственной важности | L9: 1974 | M9: художественная | N9: роман | P9: Константин Бадигин. Секрет государственной важности | Q9: 1974 | R9: книга | S9: омонимия не снята | T9: Хе-хе, механики, как всегда, перепутали клапана, подмешалась морская вода… Пользуясь случаем, поручик Сыротестов хочет взять кое-какой груз ― шерсть для валенок. [К. С. Бадигин. Секрет государственной важности (1974)] [омонимия не снята]
A10: =RAND() -> 0.81181136856417702 | B10: есв шаднараК отч ьсолинсяыв еровогзар | C10: латупереп | D10: разговоре выяснилось, что Карандаш все | E10: перепутал | F10: . | H10: Юрий Никулин. Как я стал клоуном (1979) | I10: Юрий Никулин | J10: 1921 | K10: Как я стал клоуном | L10: 1979 | M10: публицистика , нехудожественная | N10: мемуары | P10: Юрий Никулин. Почти серьезно | Q10: 1997 | R10: книга | S10: омонимия не снята | T10: В разговоре выяснилось, что Карандаш все перепутал. [Юрий Никулин. Как я стал клоуном (1979)] [омонимия не снята]
A11: =RAND() -> 0.83395309344970392 | B11: итсорп ашаС | C11: алатупереп | D11: [Princess, nick] Саша, прости, | E11: перепутала | F11: :―[ | G11: это парень моей подружки, она | H11: Переписка в icq между agd-ardin и Princess (2008.10.13) | K11: Переписка в icq между agd-ardin и Princess | L11: 2008.10.13 | M11: электронная коммуникация , нехудожественная | N11: интернет-пейджер | O11: филология, частная жизнь | R11: электронный текст | S11: омонимия не снята | T11: [Princess, nick] Саша, прости, перепутала :―[ это парень моей подружки, она в Узловой живет. он поступил на 1 курс. в универе был уже месяц назад [Переписка в icq между agd-ardin и Princess (2008.10.13)] [омонимия не снята]
A12: =RAND() -> 0.12490198584419243 | B12: ен мек с ин но | C12: театупереп | D12: он ни с кем не | E12: перепутает | G12: твое лицо. | H12: Варвара Синицына. Муза и генерал (2002) | I12: Варвара Синицына | K12: Муза и генерал | L12: 2002 | M12: художественная | N12: роман | P12: Варвара Синицына. Муза и генерал | Q12: 2002 | R12: книга | S12: омонимия не снята | T12: Шоковая терапия ― эффективное средство: зато он ни с кем не перепутает твое лицо. [Варвара Синицына. Муза и генерал (2002)] [омонимия не снята]
A13: =RAND() -> 0.14748060053906897 | B13: актсинишам еонреван отч уволог в | C13: алатупереп | D13: в голову, что, наверное, машинистка | E13: перепутала | G13: фамилии. | H13: А. И. Мусатов. Земля молодая (1960) | I13: А. И. Мусатов | J13: 1911 | K13: Земля молодая | L13: 1960 | M13: художественная | N13: повесть | P13: Собрание сочинений в 3-х томах. Т. 3 | Q13: 1978 | R13: книга | S13: омонимия не снята | T13: Потом ей пришло в голову, что, наверное, машинистка перепутала фамилии. [А. И. Мусатов. Земля молодая (1960)] [омонимия не снята]
A14: =RAND() -> 0.10607478183377506 | B14: ен ястеамолс ен ястеяретсар ен | C14: театупереп | D14: не растеряется, не сломается, не | E14: перепутает | G14: берега реки Чернобыль, правый, левый | H14: Михаил Козаков. Актерская книга (1978-1995) | I14: Михаил Козаков | J14: 1934 | K14: Актерская книга | L14: 1978-1995 | M14: публицистика , нехудожественная | N14: мемуары | P14: Михаил Козаков. Актерская книга | Q14: 1998 | R14: книга | S14: омонимия не снята | T14: Кто не растеряется, не сломается, не перепутает берега реки Чернобыль, правый, левый? [Михаил Козаков. Актерская книга (1978-1995)] [омонимия не снята]
A15: =RAND() -> 0.96979064041815599 | B15: ен огечин ыв А мидаВ | C15: илатупереп | D15: Вадим. ― А вы ничего не | E15: перепутали | F15: ? | G15: ― А что тут можно перепутать | H15: Даниил Корецкий. Менты не ангелы, но… (2011) | I15: Даниил Корецкий | J15: 1948 | K15: Менты не ангелы, но… | L15: 2011 | M15: художественная | N15: роман | P15: Д. А. Корецкий. Менты не ангелы но… | Q15: 2012 | R15: книга | S15: омонимия не снята | T15: ― Не знаю, ― растерянно сказал Вадим. ― А вы ничего не перепутали? ― А что тут можно перепутать? [Даниил Корецкий. Менты не ангелы, но… (2011)] [омонимия не снята]
A16: =RAND() -> 0.45689020455863272 | B16: от-отч но еонреваН илаВ у | C16: латупереп | D16: у Вали. ― Наверное, он что-то | E16: перепутал | F16: ! | G16: Кто-то что-то сказал ему про | H16: Татьяна Тронина. Русалка для интимных встреч (2004) | I16: Татьяна Тронина | K16: Русалка для интимных встреч | L16: 2004 | M16: художественная | N16: роман | P16: Татьяна Тронина. Русалка для интимных встреч | Q16: 2004 | R16: книга | S16: омонимия не снята | T16: ― мелькнуло в голове у Вали. ― Наверное, он что-то перепутал! Кто-то что-то сказал ему про меня… [Татьяна Тронина. Русалка для интимных встреч (2004)] [омонимия не снята]
A17: =RAND() -> 5.9618061435387837E-2 | B17: омидив ано оН | C17: алатупереп | D17: Но она, видимо, | E17: перепутала | G17: имена братьев, назвавшись дочерью казацкого | H17: Эдвард Радзинский. Княжна Тараканова (1999) | I17: Эдвард Радзинский | J17: 1936 | K17: Княжна Тараканова | L17: 1999 | M17: художественная | N17: роман | P17: Радзинский Э. Собрание сочинений: В 7 т. Т.4 | Q17: 1998 | R17: книга | S17: омонимия не снята | T17: Но она, видимо, перепутала имена братьев, назвавшись дочерью казацкого гетмана. [Эдвард Радзинский. Княжна Тараканова (1999)] [омонимия не снята]
A18: =RAND() -> 0.70513869420281949 | B18: ыВ илашулс ен янем ыв | C18: илатупереп | D18: вы меня не слушали! Вы | E18: перепутали | G18: картины! ― Что значит ― перепутал? | H18: Наталья Александрова. Последний ученик да Винчи (2010) | I18: Наталья Александрова | K18: Последний ученик да Винчи | L18: 2010 | M18: художественная | N18: роман | P18: Н. Н. Александрова. Последний ученик да Винчи | Q18: 2010 | R18: книга | S18: омонимия не снята | T18: ― Батенька, ― прервал его Лютостанский, ― я же вас пытался предупредить, но вы меня не слушали! Вы перепутали картины! ― Что значит ― перепутал? [Наталья Александрова. Последний ученик да Винчи (2010)] [омонимия не снята]
A19: =RAND() -> 0.68452089286838236 | B19: кат удюсв и как анйов | C19: алатупереп | D19: война, как и всюду, так | E19: перепутала | G19: в их редакции поколения и | H19: Константин Симонов. Так называемая личная жизнь/ Мы не увидимся с тобой... (1978) | I19: Константин Симонов | J19: 1915 | K19: Так называемая личная жизнь/ Мы не увидимся с тобой... | L19: 1978 | M19: художественная | N19: повесть | P19: Симонов К. М. Собр. соч.: В 10 т. Т.7 | Q19: 1982 | R19: книга | S19: омонимия не снята | T19: Хотя война, как и всюду, так перепутала в их редакции поколения и так свела всех на «ты», что и сам не поймешь, к какому поколению принадлежишь… [Константин Симонов. Так называемая личная жизнь/ Мы не увидимся с тобой... (1978)] [омонимия не снята]
A20: =RAND() -> 0.77353272698911812 | B20: уняьпс он уфеш умеовс к | C20: илатупереп | D20: к своему шефу, но спьяну | E20: перепутали | G20: ресторан, и чуть не попали | H20: Александр Владимиров. Вынесен приговор банде грабителей (1996) // «Коммерсантъ-Daily», 1996.01.19 | I20: Александр Владимиров | K20: Вынесен приговор банде грабителей | L20: 1996 | M20: публицистика , нехудожественная | N20: статья | O20: криминал | P20: «Коммерсантъ-Daily» | Q20: 1996.01.19 | R20: газета | S20: омонимия не снята | T20: Прихватив автомат, друзья отправились на подмогу к своему шефу, но спьяну перепутали ресторан, и чуть не попали в милицию. [Александр Владимиров. Вынесен приговор банде грабителей (1996) // «Коммерсантъ-Daily», 1996.01.19] [омонимия не снята]
A21: =RAND() -> 0.24252334396788022 | B21: онйачулс анеж отч лижолопдерп елачанв | C21: алатупереп | D21: вначале предположил, что жена случайно | E21: перепутала | G21: в лаборатории свои полоски с | H21: В. Сурдин. Туринская плащаница: научное расследование // «Наука и жизнь», 2007 | I21: В. Сурдин | K21: Туринская плащаница: научное расследование | L21: 2007 | M21: публицистика , нехудожественная | N21: статья | O21: история, религия | P21: «Наука и жизнь» | Q21: 2007 | R21: журнал | S21: омонимия не снята | T21: Результаты ее анализа оказались так похожи на результат анализа плащаницы, что МакКрон вначале предположил, что жена случайно перепутала в лаборатории свои полоски с полосками с плащаницы. [В. Сурдин. Туринская плащаница: научное расследование // «Наука и жизнь», 2007] [омонимия не снята]
A22: =RAND() -> 0.22706508860398333 | B22: отч теачевто олесев енм но | C22: латупереп | D22: он мне весело отвечает, что | E22: перепутал | G22: мой адрес. | H22: В. В. Голявкин. Веселые ребята (1973) | I22: В. В. Голявкин | J22: 1929 | K22: Веселые ребята | L22: 1973 | M22: художественная | N22: рассказ | P22: Виктор Голявкин. «Большие скорости». Роман, рассказы | Q22: 1988 | R22: книга | S22: омонимия не снята | T22: Звоню в телевизионное ателье на другой день, спрашиваю техника, интересуюсь, почему он вчера не пришел, а он мне весело отвечает, что перепутал мой адрес. [В. В. Голявкин. Веселые ребята (1973)] [омонимия не снята]
A23: =RAND() -> 0.42734097095999291 | B23: 555йескелА | C23: латупереП | D23: Алексей555. | E23: Перепутал | G23: советскую и постсоветскую деградацию. Если | H23: коллективный. Форум: Этнопсихология. Менталитет украинцев (2012) | I23: коллективный | K23: Форум: Этнопсихология. Менталитет украинцев | L23: 2012 | M23: электронная коммуникация , нехудожественная | N23: форум | O23: частная жизнь, политика и общественная жизнь | P23: http://www.balto-slavica.com/post1950/forum/index.php?showtopic=13168&hl=%EC%E5%ED%F2%E0%EB%E8%F2%E5%F2 | R23: электронный текст | S23: омонимия не снята | T23: . Перепутал советскую и постсоветскую деградацию. Если брать постсоветский период, то в этом смысле русские в плане бытого обустройства своего жизненного пространства по моим наблюдениям догоняют остальные народы. [коллективный. Форум: Этнопсихология. Менталитет украинцев (2012)] [омонимия не снята]
A24: =RAND() -> 0.1353731226429371 | B24: ен саВ | C24: илатупереп | D24: ― Вас не | E24: перепутали | F24: , | G24: Киселева вас нарочно подменила. | H24: Татьяна Сахарова. Добрая фея с острыми зубками (2005) | I24: Татьяна Сахарова | K24: Добрая фея с острыми зубками | L24: 2005 | M24: художественная | N24: роман | P24: Т. В. Сахарова. Добрая фея с острыми зубками | Q24: 2005 | R24: книга | S24: омонимия не снята | T24: ― Вас не перепутали, Киселева вас нарочно подменила. [Татьяна Сахарова. Добрая фея с острыми зубками (2005)] [омонимия не снята]
A25: =RAND() -> 3.8370110303242999E-3 | B25: онреваН ьсолинмоп отэ каК | C25: латупереп | D25: «Как это «помнилось»?» «Наверно, | E25: перепутал | G25: с прошлым годом. Я разве | H25: Владислав Крапивин. Болтик (1976) | I25: Владислав Крапивин | J25: 1938 | K25: Болтик | L25: 1976 | M25: художественная | N25: повесть | P25: Крапивин В. Мушкетер и Фея | Q25: 1980 | R25: книга | S25: омонимия не снята | T25: «Как это «помнилось»?» «Наверно, перепутал с прошлым годом. Я разве отказывался? [Владислав Крапивин. Болтик (1976)] [омонимия не снята]

Sheet: 1.4 (перепутать)
A1: Названия строк | B1: Количество по полю Center
A2: А. И. Мусатов | B2: 1
A3: А. М. Володин | B3: 1
A4: Александр Владимиров | B4: 1
A5: Александр Городницкий | B5: 1
A6: Александр Зиновьев | B6: 1
A7: Алексей Макушинский | B7: 1
A8: Алла Сурикова | B8: 2
A9: Андрей Белозеров | B9: 1
A10: Андрей Попов | B10: 1
A11: Борис Левин | B11: 1
A12: В. А. Каверин | B12: 2
A13: В. В. Голявкин | B13: 1
A14: В. Кочетов | B14: 1
A15: В. Лихоносов | B15: 1
A16: В. Сурдин | B16: 1
A17: Варвара Синицына | B17: 1
A18: Василий Аксенов | B18: 1
A19: Владимир Войнович | B19: 1
A20: Владимир Маккавеев | B20: 1
A21: Владислав Быков, Ольга Деркач | B21: 2
A22: Владислав Крапивин | B22: 1
A23: Галина Щербакова | B23: 1
A24: Даниил Корецкий | B24: 2
A25: Екатерина Каретникова | B25: 1
A26: Елизавета Козырева | B26: 1
A27: Ирина Полянская | B27: 1
A28: К. С. Бадигин | B28: 1
A29: коллективный | B29: 1
A30: Константин Симонов | B30: 1
A31: Любовь Кабо | B31: 1
A32: Марина Вишневецкая | B32: 2
A33: Михаил Козаков | B33: 1
A34: Наталья Александрова | B34: 1
A35: Николай Климонтович | B35: 1
A36: Нина Катерли | B36: 1
A37: Нина Садур | B37: 1
A38: Татьяна Сахарова | B38: 1
A39: Татьяна Тронина | B39: 1
A40: Эдвард Радзинский | B40: 1
A41: Ю. В. Трифонов | B41: 1
A42: Юлий Даниэль | B42: 1
A43: Юрий Никулин | B43: 1
A44: Общий итог | B44: 49

Sheet: 1.6
A1: PARTICIPANT3 (с кем путают) | B1: PARTICIPANT2 | C1: PARTICIPANT1 | D1: PERSONNUMBER | E1: TENSE | F1: PREFIX | G1: ГОД СОЗДАНИЯ
A2: NA | B2: абстрактный объект | C2: одушевлённый конкретный субъект | D2: 3 л., ед.ч. | E2: прош | F2: пере | G2: 1996 | H2: =RAND() -> 0.43770385265974898 | I2: есв ано оН | J2: алатупереп | K2: Но она все | L2: перепутала | N2: и положила цветы на колени | O2: Ирина Полянская. Прохождение тени (1996) | P2: Ирина Полянская | Q2: 1969 | R2: Прохождение тени | S2: художественная | T2: роман | V2: Полянская И. Прохождение тени | W2: 1999 | X2: книга | Y2: омонимия не снята | Z2: Но она все перепутала и положила цветы на колени Теймуразу. [Ирина Полянская. Прохождение тени (1996)] [омонимия не снята]
A3: NA | B3: абстрактный объект | C3: одушевлённый конкретный субъект | D3: 3 л., ед.ч. | E3: прош | F3: пере | G3: 1983 | H3: =RAND() -> 0.63552781777231582 | I3: ястежак анО | J3: алатупереп | K3: Она, кажется, | L3: перепутала | N3: время и дожидается, сложив на | O3: В. Лихоносов. Ненаписанные воспоминания. Наш маленький Париж. Ч. 5 (1983) | P3: В. Лихоносов | Q3: 1936 | R3: Ненаписанные воспоминания. Наш маленький Париж. Ч. 5 | S3: художественная | T3: роман | V3: В. И. Лихоносов. Ненаписанные воспоминания. Наш маленький Париж | W3: 1987 | X3: книга | Y3: омонимия не снята | Z3: Она, кажется, перепутала время и дожидается, сложив на подоконнике руки, когда стемнеет? [В. Лихоносов. Ненаписанные воспоминания. Наш маленький Париж. Ч. 5 (1983)] [омонимия не снята]
A4: неодушевлённый конкретный объект | B4: NA | C4: NA | D4: NA, ед.ч. | E4: прош | F4: пере | G4: 1997 | H4: =RAND() -> 0.1545861433336233 | I4: еинавориднумбо еонневтсечакен иимра йоксрац лялватсоп | J4: латупереп | K4: поставлял царской армии некачественное обмундирование) | L4: перепутал | N4: с сокровищами Трои (найденный им | O4: Афиша (1997) // «Столица», 1997.04.01 | R4: Афиша | S4: публицистика , нехудожественная | T4: обзор | U4: досуг, зрелища и развлечения | V4: «Столица» | W4: 1997.04.01 | X4: журнал | Y4: омонимия не снята | Z4: Найдите наконец 50 тысяч и час-полтора времени и взгляните на золотые украшения, которые археолог-дилетант (россиянам известный еще и тем, что поставлял царской армии некачественное обмундирование) перепутал с сокровищами Трои (найденный им клад был зарыт на тысячу лет раньше, чем троянцы и ахейцы не поделили Прекрасную Елену). [Афиша (1997) // «Столица», 1997.04.01] [омонимия не снята]
A5: NA | B5: абстрактный объект | C5: NA | D5: NA, ед.ч. | E5: прош | F5: пере | G5: 1988-1998 | H5: =RAND() -> 0.64941097690799077 | I5: и ламолоп юлмез ан яслишурбо | J5: латупереп | K5: обрушился на землю, поломал и | L5: перепутал | N5: все, лишил людей пространственно-временных координат | O5: Александр Зиновьев. Русская судьба, исповедь отщепенца (1988-1998) | P5: Александр Зиновьев | Q5: 1922 | R5: Русская судьба, исповедь отщепенца | S5: публицистика , нехудожественная | T5: мемуары | V5: А. А. Зиновьев. Русская судьба, исповедь отщепенца | W5: 1999 | X5: книга | Y5: омонимия не снята | Z5: Ощущение было такое, будто какой-то страшный ураган обрушился на землю, поломал и перепутал все, лишил людей пространственно-временных координат. [Александр Зиновьев. Русская судьба, исповедь отщепенца (1988-1998)] [омонимия не снята]
A6: NA | B6: абстрактный объект | C6: одушевлённый конкретный субъект | D6: 3 л., мн.ч. | E6: прош | F6: пере | G6: 2012 | H6: =RAND() -> 0.61848893250224712 | I6: ёсв есв отч ьсолинсяыв гурдв | J6: илатупереп | K6: вдруг выяснилось, что все всё | L6: перепутали | M6: , | N6: то ли Света все перепутала | O6: Алексей Макушинский. Город в долине (2012) | P6: Алексей Макушинский | Q6: 1960 | R6: Город в долине | S6: художественная | T6: роман | V6: Алексей Макушинский. Город в долине | W6: 2013 | X6: книга | Y6: омонимия не снята | Z6: Недели за две до моего и за неделю до их отъезда вдруг выяснилось, что все всё перепутали, то ли Света все перепутала (что вообще-то было на нее не похоже), то ли Двигубский все перепутал, то ли я их понял неправильно, и что дом, куда мы должны были ехать, вовсе никакой не дом, но ― квартира, и находится она не возле Лукки, но гораздо южнее,за Ливорно, чуть-чуть не доезжая до Гроссетто, в местности, называемой Маремма (название, сказал мне Двигубский, как будто из какого-то сна…), в местечке с не менее пленительным названием Кастильоне делла Пескайя, до которого я добирался, я помню, почти двое суток, заночевав в Вероне с ее знаменитым амфитеатром и пресловутым балконом Джульетты, добычей туристских толп, наседающих друг на друга в неизменном своем обалдении. [Алексей Макушинский. Город в долине (2012)] [омонимия не снята]
A7: NA | B7: неодушевлённый конкретный объект | C7: одушевлённый конкретный субъект | D7: 3 л., ед.ч. | E7: прош | F7: пере | G7: 1995 | H7: =RAND() -> 0.51632117763995944 | I7: екшепс в умеом-оп цензук окьлоТ | J7: латупереп | K7: Только кузнец по-моему в спешке | L7: перепутал | N7: подковы. | O7: Борис Левин. Блуждающие огни (1995) | P7: Борис Левин | Q7: 1938 | R7: Блуждающие огни | S7: художественная | T7: роман | V7: Борис Левин. Инородное тело. Автобиографическая проза и поэзия | W7: 2002 | X7: книга | Y7: омонимия не снята | Z7: ― Только кузнец по-моему в спешке перепутал подковы. [Борис Левин. Блуждающие огни (1995)] [омонимия не снята]
A8: NA | B8: абстрактный объект | C8: одушевлённый конкретный субъект | D8: 2 л., мн.ч. | E8: прош | F8: пере | G8: 2007 | H8: =RAND() -> 0.78669230903419507 | I8: есв ыв адопсог уссерп юукснитнегра | J8: илатупереп | K8: аргентинскую прессу: господа , вы все | L8: перепутали | M8: , | N8: знаменитый советский писатель ― это мой | O8: Василий Аксенов. Таинственная страсть (2007) | P8: Василий Аксенов | Q8: 1932 | R8: Таинственная страсть | S8: художественная | T8: роман | V8: Аксенов В. П. Таинственная страсть. Роман о шестидесятниках | W8: 2009 | X8: книга | Y8: омонимия не снята | Z8: Розовый дворец и гарцующие вокруг президентские кавалергарды; аргентинская переводчица княжна Мышкина, высокая, чуть сутуловатая девушка ― отпрыск Добровольческой армии, которую расхристанные журналисты принимали за советскую кинозвезду; караван фестиваля, несущийся через выжженную солнцем пампу, в которой то и дело возникают гигантские строения рекламных сигаретных пачек; накат океана, выгнутая дугой полоса отелей, толпы фанатиков кино в шортах и купальниках, плывущая над толпой на крыше автобуса дочь,мать , сестра и супруга аргентинских трудящихся, суперактриса по имени Ла Бомба, можете к этому имени прибавить то, что вам рисует воображение, а Ваксона и Ливана, можно надеяться, оно не подведет; ковровая дорожка фестиваля, по которой мы следуем вслед за американцами по латинскому алфавиту, вот оборачивается на подъеме по лестнице противоположность крутобедрой и высокогрудой Ла Бомбы, девушка Дальнего Запада соломенногривая Элизабет Сазерлэнд, а вслед за ней движется длиннорукий и быковатый кинозлодей Чак Паланс (он же по рождению Остап Охрименко), умеющий стоять на одной ладони, держа свое мощное тело параллельно земле: ночь триумфа для Орсона Уэллса, доставившего сюда ленту по мотивам романа Кафки «Процесс» с Роми Шнайдер в главной женской роли, ошеломленные зрители в смежных кафе гудят до утра, а мы не можем так гудеть, потому что у нас не хватает песо даже на пиво; фольклорные праздники народов латино, на которых каждый раз побеждает огромный мексиканский петух с гитарой в окружении коротконогих курочек с трубами; Виктор Степаныч Сытский, играющий роль «чеховского интеллигента», окруженного молодыми агентами КГБ Ливаном, Ваксоном и Эдуардо, дает пресс-конференцию на фестивале, «агенты» хохочут, слушая глубоко партийные речи «Парткомыча», и тут знаменитый итальянский писатель Васко Пратолини встает и просвещает провинциальную аргентинскую прессу: господа , вы все перепутали, знаменитый советский писатель ― это мой почти тезка синьор Ваксон, именно вот этот молодой человек, чей протестный роман только что вышел у нас в Италии, а вот товарища Сытского у нас даже в компартии никто не знает; Сытский на грани нервного приступа бегает по набережным, пытается собрать всех в кучу ― товарищи, товарищи, вы что, не видите, какая вокруг сложная обстановка, ведь мы окружены врагами; вот парадокс, тут оказывается, масса русских, иной раз на пляже прислушаешься ― то тут, то там говорят по-русски ― «Вера Николаевна, а почему бы нам летом, в январе, не поехать в Европу?» [Василий Аксенов. Таинственная страсть (2007)] [омонимия не снята]
A9: NA | B9: неодушевлённый конкретный объект | C9: одушевлённый конкретный субъект | D9: 3 л., мн.ч. | E9: прош | F9: пере | G9: 1974 | H9: =RAND() -> 0.6114295295337131 | I9: адгесв как икинахем ех-еХ | J9: илатупереп | K9: Хе-хе, механики, как всегда, | L9: перепутали | N9: клапана, подмешалась морская вода… Пользуясь | O9: К. С. Бадигин. Секрет государственной важности (1974) | P9: К. С. Бадигин | Q9: 1910 | R9: Секрет государственной важности | S9: художественная | T9: роман | V9: Константин Бадигин. Секрет государственной важности | W9: 1974 | X9: книга | Y9: омонимия не снята | Z9: Хе-хе, механики, как всегда, перепутали клапана, подмешалась морская вода… Пользуясь случаем, поручик Сыротестов хочет взять кое-какой груз ― шерсть для валенок. [К. С. Бадигин. Секрет государственной важности (1974)] [омонимия не снята]
A10: NA | B10: абстрактный объект | C10: одушевлённый конкретный субъект | D10: 3 л., ед.ч. | E10: прош | F10: пере | G10: 1979 | H10: =RAND() -> 0.41996357999492329 | I10: есв шаднараК отч ьсолинсяыв еровогзар | J10: латупереп | K10: разговоре выяснилось, что Карандаш все | L10: перепутал | M10: . | O10: Юрий Никулин. Как я стал клоуном (1979) | P10: Юрий Никулин | Q10: 1921 | R10: Как я стал клоуном | S10: публицистика , нехудожественная | T10: мемуары | V10: Юрий Никулин. Почти серьезно | W10: 1997 | X10: книга | Y10: омонимия не снята | Z10: В разговоре выяснилось, что Карандаш все перепутал. [Юрий Никулин. Как я стал клоуном (1979)] [омонимия не снята]
A11: NA | B11: NA | C11: NA | D11: 3 л., ед.ч. | E11: прош | F11: пере | G11: 2008.10.13 | H11: =RAND() -> 8.0666848886942866E-2 | I11: итсорп ашаС | J11: алатупереп | K11: [Princess, nick] Саша, прости, | L11: перепутала | M11: :―[ | N11: это парень моей подружки, она | O11: Переписка в icq между agd-ardin и Princess (2008.10.13) | R11: Переписка в icq между agd-ardin и Princess | S11: электронная коммуникация , нехудожественная | T11: интернет-пейджер | U11: филология, частная жизнь | X11: электронный текст | Y11: омонимия не снята | Z11: [Princess, nick] Саша, прости, перепутала :―[ это парень моей подружки, она в Узловой живет. он поступил на 1 курс. в универе был уже месяц назад [Переписка в icq между agd-ardin и Princess (2008.10.13)] [омонимия не снята]
A12: NA | B12: неодушевлённый конкретный объект | C12: одушевлённый конкретный субъект | D12: 3 л., ед.ч. | E12: буд | F12: пере | G12: 2002 | H12: =RAND() -> 0.54970425388335364 | I12: ен мек с ин но | J12: театупереп | K12: он ни с кем не | L12: перепутает | N12: твое лицо. | O12: Варвара Синицына. Муза и генерал (2002) | P12: Варвара Синицына | R12: Муза и генерал | S12: художественная | T12: роман | V12: Варвара Синицына. Муза и генерал | W12: 2002 | X12: книга | Y12: омонимия не снята | Z12: Шоковая терапия ― эффективное средство: зато он ни с кем не перепутает твое лицо. [Варвара Синицына. Муза и генерал (2002)] [омонимия не снята]
A13: NA | B13: абстрактный объект | C13: одушевлённый конкретный субъект | D13: 3 л., ед.ч. | E13: прош | F13: пере | G13: 1960 | H13: =RAND() -> 0.55715651455921922 | I13: актсинишам еонреван отч уволог в | J13: алатупереп | K13: в голову, что, наверное, машинистка | L13: перепутала | N13: фамилии. | O13: А. И. Мусатов. Земля молодая (1960) | P13: А. И. Мусатов | Q13: 1911 | R13: Земля молодая | S13: художественная | T13: повесть | V13: Собрание сочинений в 3-х томах. Т. 3 | W13: 1978 | X13: книга | Y13: омонимия не снята | Z13: Потом ей пришло в голову, что, наверное, машинистка перепутала фамилии. [А. И. Мусатов. Земля молодая (1960)] [омонимия не снята]
A14: NA | B14: неодушевлённый конкретный объект | C14: NA | D14: NA, ед.ч. | E14: буд | F14: пере | G14: 1978-1995 | H14: =RAND() -> 0.25725326724175557 | I14: ен ястеамолс ен ястеяретсар ен | J14: театупереп | K14: не растеряется, не сломается, не | L14: перепутает | N14: берега реки Чернобыль, правый, левый | O14: Михаил Козаков. Актерская книга (1978-1995) | P14: Михаил Козаков | Q14: 1934 | R14: Актерская книга | S14: публицистика , нехудожественная | T14: мемуары | V14: Михаил Козаков. Актерская книга | W14: 1998 | X14: книга | Y14: омонимия не снята | Z14: Кто не растеряется, не сломается, не перепутает берега реки Чернобыль, правый, левый? [Михаил Козаков. Актерская книга (1978-1995)] [омонимия не снята]
A15: NA | B15: абстрактный объект | C15: одушевлённый конкретный субъект | D15: 2 л., мн.ч. | E15: прош | F15: пере | G15: 2011 | H15: =RAND() -> 9.4828273750435343E-2 | I15: ен огечин ыв А мидаВ | J15: илатупереп | K15: Вадим. ― А вы ничего не | L15: перепутали | M15: ? | N15: ― А что тут можно перепутать | O15: Даниил Корецкий. Менты не ангелы, но… (2011) | P15: Даниил Корецкий | Q15: 1948 | R15: Менты не ангелы, но… | S15: художественная | T15: роман | V15: Д. А. Корецкий. Менты не ангелы но… | W15: 2012 | X15: книга | Y15: омонимия не снята | Z15: ― Не знаю, ― растерянно сказал Вадим. ― А вы ничего не перепутали? ― А что тут можно перепутать? [Даниил Корецкий. Менты не ангелы, но… (2011)] [омонимия не снята]
A16: NA | B16: абстрактный объект | C16: одушевлённый конкретный субъект | D16: 3 л., ед.ч. | E16: прош | F16: пере | G16: 2004 | H16: =RAND() -> 0.12705534290421294 | I16: от-отч но еонреваН илаВ у | J16: латупереп | K16: у Вали. ― Наверное, он что-то | L16: перепутал | M16: ! | N16: Кто-то что-то сказал ему про | O16: Татьяна Тронина. Русалка для интимных встреч (2004) | P16: Татьяна Тронина | R16: Русалка для интимных встреч | S16: художественная | T16: роман | V16: Татьяна Тронина. Русалка для интимных встреч | W16: 2004 | X16: книга | Y16: омонимия не снята | Z16: ― мелькнуло в голове у Вали. ― Наверное, он что-то перепутал! Кто-то что-то сказал ему про меня… [Татьяна Тронина. Русалка для интимных встреч (2004)] [омонимия не снята]
A17: NA | B17: абстрактный объект | C17: одушевлённый конкретный субъект | D17: 3 л., ед.ч. | E17: прош | F17: пере | G17: 1999 | H17: =RAND() -> 6.8084513921775169E-2 | I17: омидив ано оН | J17: алатупереп | K17: Но она, видимо, | L17: перепутала | N17: имена братьев, назвавшись дочерью казацкого | O17: Эдвард Радзинский. Княжна Тараканова (1999) | P17: Эдвард Радзинский | Q17: 1936 | R17: Княжна Тараканова | S17: художественная | T17: роман | V17: Радзинский Э. Собрание сочинений: В 7 т. Т.4 | W17: 1998 | X17: книга | Y17: омонимия не снята | Z17: Но она, видимо, перепутала имена братьев, назвавшись дочерью казацкого гетмана. [Эдвард Радзинский. Княжна Тараканова (1999)] [омонимия не снята]
A18: NA | B18: неодушевлённый конкретный объект | C18: одушевлённый конкретный субъект | D18: 2 л., мн.ч. | E18: прош | F18: пере | G18: 2010 | H18: =RAND() -> 8.628600590942348E-2 | I18: ыВ илашулс ен янем ыв | J18: илатупереп | K18: вы меня не слушали! Вы | L18: перепутали | N18: картины! ― Что значит ― перепутал? | O18: Наталья Александрова. Последний ученик да Винчи (2010) | P18: Наталья Александрова | R18: Последний ученик да Винчи | S18: художественная | T18: роман | V18: Н. Н. Александрова. Последний ученик да Винчи | W18: 2010 | X18: книга | Y18: омонимия не снята | Z18: ― Батенька, ― прервал его Лютостанский, ― я же вас пытался предупредить, но вы меня не слушали! Вы перепутали картины! ― Что значит ― перепутал? [Наталья Александрова. Последний ученик да Винчи (2010)] [омонимия не снята]
A19: NA | B19: абстрактный объект | C19: абстрактный субъект | D19: 3 л., ед.ч. | E19: прош | F19: пере | G19: 1978 | H19: =RAND() -> 0.74570158172344403 | I19: кат удюсв и как анйов | J19: алатупереп | K19: война, как и всюду, так | L19: перепутала | N19: в их редакции поколения и | O19: Константин Симонов. Так называемая личная жизнь/ Мы не увидимся с тобой... (1978) | P19: Константин Симонов | Q19: 1915 | R19: Так называемая личная жизнь/ Мы не увидимся с тобой... | S19: художественная | T19: повесть | V19: Симонов К. М. Собр. соч.: В 10 т. Т.7 | W19: 1982 | X19: книга | Y19: омонимия не снята | Z19: Хотя война, как и всюду, так перепутала в их редакции поколения и так свела всех на «ты», что и сам не поймешь, к какому поколению принадлежишь… [Константин Симонов. Так называемая личная жизнь/ Мы не увидимся с тобой... (1978)] [омонимия не снята]
A20: NA | B20: неодушевлённый конкретный объект | C20: NA | D20: NA, мн.ч. | E20: прош | F20: пере | G20: 1996 | H20: =RAND() -> 0.59666976741240174 | I20: уняьпс он уфеш умеовс к | J20: илатупереп | K20: к своему шефу, но спьяну | L20: перепутали | N20: ресторан, и чуть не попали | O20: Александр Владимиров. Вынесен приговор банде грабителей (1996) // «Коммерсантъ-Daily», 1996.01.19 | P20: Александр Владимиров | R20: Вынесен приговор банде грабителей | S20: публицистика , нехудожественная | T20: статья | U20: криминал | V20: «Коммерсантъ-Daily» | W20: 1996.01.19 | X20: газета | Y20: омонимия не снята | Z20: Прихватив автомат, друзья отправились на подмогу к своему шефу, но спьяну перепутали ресторан, и чуть не попали в милицию. [Александр Владимиров. Вынесен приговор банде грабителей (1996) // «Коммерсантъ-Daily», 1996.01.19] [омонимия не снята]
A21: NA | B21: неодушевлённый конкретный объект | C21: одушевлённый конкретный субъект | D21: 3 л., ед.ч. | E21: прош | F21: пере | G21: 2007 | H21: =RAND() -> 4.8862900895572103E-2 | I21: онйачулс анеж отч лижолопдерп елачанв | J21: алатупереп | K21: вначале предположил, что жена случайно | L21: перепутала | N21: в лаборатории свои полоски с | O21: В. Сурдин. Туринская плащаница: научное расследование // «Наука и жизнь», 2007 | P21: В. Сурдин | R21: Туринская плащаница: научное расследование | S21: публицистика , нехудожественная | T21: статья | U21: история, религия | V21: «Наука и жизнь» | W21: 2007 | X21: журнал | Y21: омонимия не снята | Z21: Результаты ее анализа оказались так похожи на результат анализа плащаницы, что МакКрон вначале предположил, что жена случайно перепутала в лаборатории свои полоски с полосками с плащаницы. [В. Сурдин. Туринская плащаница: научное расследование // «Наука и жизнь», 2007] [омонимия не снята]
A22: NA | B22: абстрактный объект | C22: одушевлённый конкретный субъект | D22: 3 л., ед.ч. | E22: прош | F22: пере | G22: 1973 | H22: =RAND() -> 0.29705029498879809 | I22: отч теачевто олесев енм но | J22: латупереп | K22: он мне весело отвечает, что | L22: перепутал | N22: мой адрес. | O22: В. В. Голявкин. Веселые ребята (1973) | P22: В. В. Голявкин | Q22: 1929 | R22: Веселые ребята | S22: художественная | T22: рассказ | V22: Виктор Голявкин. «Большие скорости». Роман, рассказы | W22: 1988 | X22: книга | Y22: омонимия не снята | Z22: Звоню в телевизионное ателье на другой день, спрашиваю техника, интересуюсь, почему он вчера не пришел, а он мне весело отвечает, что перепутал мой адрес. [В. В. Голявкин. Веселые ребята (1973)] [омонимия не снята]
A23: NA | B23: абстрактный объект | C23: абстрактный субъект | D23: 3 л., ед.ч. | E23: прош | F23: пере | G23: 1978 | H23: =RAND() -> 7.6130240163401197E-3 | I23: ёсв хартС ясьтариваз ясьтавиравогорп ясьтатуп | J23: латупереп | K23: путаться, проговариваться, завираться. Страх всё | L23: перепутал | M23: , | N23: всё сместил. Ведь до сих | O23: Ю. О. Домбровский. Факультет ненужных вещей, часть 5 (1978) | P23: Ю. О. Домбровский | Q23: 1909 | R23: Факультет ненужных вещей, часть 5 | S23: художественная | T23: роман | V23: Домбровский Ю.О. Собр. соч.: В 6 т. Т. 5 | W23: 1992 | X23: книга | Y23: омонимия снята | Z23: И он понимает тоже, что я расколол его, и начинает вдруг метаться, путаться, проговариваться, завираться. Страх всё перепутал, всё сместил. Ведь до сих пор он жил в одиночке, отгородившись от всех, и думал, что нет к нему входа никому, и вот вдруг дверь распахнулась ― и на пороге стою я. [Ю. О. Домбровский. Факультет ненужных вещей, часть 5 (1978)] [омонимия снята]
A24: NA | B24: одушевлённый конкретный объект | C24: NA | D24: NA, мн.ч. | E24: прош | F24: пере | G24: 2005 | H24: =RAND() -> 0.37802427646829351 | I24: ен саВ | J24: илатупереп | K24: ― Вас не | L24: перепутали | M24: , | N24: Киселева вас нарочно подменила. | O24: Татьяна Сахарова. Добрая фея с острыми зубками (2005) | P24: Татьяна Сахарова | R24: Добрая фея с острыми зубками | S24: художественная | T24: роман | V24: Т. В. Сахарова. Добрая фея с острыми зубками | W24: 2005 | X24: книга | Y24: омонимия не снята | Z24: ― Вас не перепутали, Киселева вас нарочно подменила. [Татьяна Сахарова. Добрая фея с острыми зубками (2005)] [омонимия не снята]
A25: абстрактный объект | B25: абстрактный объект | C25: NA | D25: NA, ед.ч. | E25: прош | F25: пере | G25: 2012 | H25: =RAND() -> 0.61329680770272721 | I25: 555йескелА | J25: латупереП | K25: Алексей555. | L25: Перепутал | N25: советскую и постсоветскую деградацию. Если | O25: коллективный. Форум: Этнопсихология. Менталитет украинцев (2012) | P25: коллективный | R25: Форум: Этнопсихология. Менталитет украинцев | S25: электронная коммуникация , нехудожественная | T25: форум | U25: частная жизнь, политика и общественная жизнь | V25: http://www.balto-slavica.com/post1950/forum/index.php?showtopic=13168&hl=%EC%E5%ED%F2%E0%EB%E8%F2%E5%F2 | X25: электронный текст | Y25: омонимия не снята | Z25: . Перепутал советскую и постсоветскую деградацию. Если брать постсоветский период, то в этом смысле русские в плане бытого обустройства своего жизненного пространства по моим наблюдениям догоняют остальные народы. [коллективный. Форум: Этнопсихология. Менталитет украинцев (2012)] [омонимия не снята]
A26: абстрактный объект | B26: абстрактный объект | C26: NA | D26: NA, ед.ч. | E26: прош | F26: пере | G26: 2009 | H26: =RAND() -> 0.25349934921972705 | I26: ырфиц евД ончот отэ римидалВ | J26: латупереп | K26: Владимир, это точно…» — …Две цифры | L26: перепутал | M26: — | N26: пять и шесть! И семерку | O26: А. В. Жвалевский, Е. Пастернак. Время всегда хорошее (2009) | P26: А. В. Жвалевский, Е. Пастернак | Q26: 1967 | R26: Время всегда хорошее | S26: художественная | T26: повесть | V26: А. Жвалевский, Е. Пастернак. Время всегда хорошее | W26: 2009 | X26: книга | Y26: омонимия не снята | Z26: А я: «Ну, не Владимир, это точно…» — …Две цифры перепутал — пять и шесть! И семерку за это ставить? [А. В. Жвалевский, Е. Пастернак. Время всегда хорошее (2009)] [омонимия не снята]
A27: NA | B27: NA | C27: одушевлённый конкретный субъект | D27: 1 л., мн.ч. | E27: буд | F27: с | G27: 2002-2004 | H27: =RAND() -> 0.51564091067286499 | I27: ен ыМ уничнок и ценок | J27: меатупс | K27: конец и кончину». Мы не | L27: спутаем | M27: . | N27: Мы знаем: за кончиной не | O27: Галина Шергова. …Об известных всем (2002-2004) | P27: Галина Шергова | Q27: 1923 | R27: …Об известных всем | S27: публицистика , нехудожественная | T27: мемуары | V27: Г. Шергова. …Об известных всем | W27: 2004 | X27: книга | Y27: омонимия не снята
A28: одушевлённый конкретный объект | B28: одушевлённый конкретный объект | C28: одушевлённый конкретный субъект | D28: 3 л., ед.ч. | E28: прош | F28: с | G28: 1989 | H28: =RAND() -> 0.2375764694719269 | I28: янем но мек с огот | J28: латупс | K28: того, с кем он меня | L28: спутал | M28: , | N28: думал дядя Сандро, радуясь, что | O28: Фазиль Искандер. Сандро из Чегема (Книга 1) (1989) | P28: Фазиль Искандер | Q28: 1929 | R28: Сандро из Чегема (Книга 1) | S28: художественная | T28: роман | V28: Ф. А. Искандер. «Сандро из Чегема». Кн. 1 | W28: 1989 | X28: книга | Y28: омонимия не снята
A29: NA | B29: NA | C29: NA | D29: NA, ед.ч. | E29: прош | F29: с | G29: 1971-1975 | H29: =RAND() -> 0.46612833446093305 | J29: латупС | L29: Спутал | M29: ― | N29: к счастью, и это многое | O29: Е. М. Мелетинский. Моя тюрьма (1971-1975) | P29: Е. М. Мелетинский | Q29: 1918 | R29: Моя тюрьма | S29: публицистика , нехудожественная | T29: мемуары | V29: Мелетинский Е. М. Избранные статьи. Воспоминания | W29: 1998 | X29: книга | Y29: омонимия не снята
A30: одушевлённый конкретный объект | B30: NA | C30: NA | D30: 2 л., ед.ч. | E30: буд | F30: с | G30: 2008-2009 | H30: =RAND() -> 0.72560523834768476 | I30: ен мыни мек с ин | J30: ьшеатупс | K30: ни с кем иным не | L30: спутаешь | M30: . | O30: Дина Рубина. Белая голубка Кордовы (2008-2009) | P30: Дина Рубина | Q30: 1953 | R30: Белая голубка Кордовы | S30: художественная | T30: роман | V30: Дина Рубина. Белая голубка Кордовы | W30: 2009 | X30: книга | Y30: омонимия не снята
A31: NA | B31: неодушевлённый конкретный объект | C31: абстрактный субъект | D31: 3 л., ед.ч. | E31: прош | F31: с | G31: 2002 | H31: =RAND() -> 0.61974784399403959 | I31: дапс йиксечимонокэ йоворим окандо адраиллим | J31: латупс | K31: миллиарда, однако мировой экономический спад | L31: спутал | N31: все карты. | O31: Роман Дорохов. Жизнь с «Понедельника». IBM покупает консалтинговое подразделение одного из «большой четверки» (2002) // «Известия», 2002.07.31 | P31: Роман Дорохов | R31: Жизнь с «Понедельника». IBM покупает консалтинговое подразделение одного из «большой четверки» | S31: публицистика , нехудожественная | T31: статья | U31: наука и технологии | V31: «Известия» | W31: 2002.07.31 | X31: газета | Y31: омонимия не снята
A32: NA | B32: неодушевлённый конкретный объект | C32: одушевлённый конкретный субъект | D32: 3 л., ед.ч. | E32: прош | F32: с | G32: 2001 | H32: =RAND() -> 0.31215361127767283 | I32: уме ытрак есв окандО | J32: латупс | K32: Однако все карты ему | L32: спутал | N32: Митчелл, который, нарочито не замечая | O32: Денис Быстров. Третий лишний. Президенту Кузину не нашлось места в руководстве ФИБА (2001) // «Известия», 2001.07.09 | P32: Денис Быстров | R32: Третий лишний. Президенту Кузину не нашлось места в руководстве ФИБА | S32: публицистика , нехудожественная | T32: статья | U32: спорт | V32: «Известия» | W32: 2001.07.09 | X32: газета | Y32: омонимия не снята
A33: NA | B33: одушевлённый конкретный объект | C33: абстрактный субъект | D33: 3 л., ед.ч. | E33: прош | F33: с | G33: 1975-1977 | H33: =RAND() -> 0.47875976782823759 | I33: янем и йывон ьседз я | J33: алатупс | K33: я здесь новый, и меня | L33: спутала | N33: фамилия, ― ответил один из бандитов | O33: В. П. Катаев. Алмазный мой венец (1975-1977) | P33: В. П. Катаев | Q33: 1897 | R33: Алмазный мой венец | S33: художественная | T33: роман | V33: Катаев В. Трава забвенья. | W33: 1997 | X33: книга | Y33: омонимия снята
A34: абстрактный объект | B34: NA | C34: одушевлённый конкретный субъект | D34: 3 л., ед.ч. | E34: прош | F34: с | G34: 1940-1954 | H34: =RAND() -> 0.89107984314496047 | I34: ротва онтяорѣВ | J34: латупс | K34: Вѣроятно, автор | L34: спутал | N34: с тѣм, что было наканунѣ | O34: C. П. Мельгунов. Мартовскіе Дни 1917 года (1940-1954) | P34: C. П. Мельгунов | Q34: 1879 | R34: Мартовскіе Дни 1917 года | S34: публицистика, нехудожественная | T34: монография | U34: история, политика и общественная жизнь | V34: Личная библіотека B. Z. http://boomzoomer. livejournal.com | W34: 1961 | X34: книга | Y34: омонимия не снята
A35: одушевлённый конкретный объект | B35: NA | C35: одушевлённый конкретный субъект | D35: 1 л., ед.ч. | E35: буд | F35: с | G35: 2002 | H35: =RAND() -> 0.19784044981645277 | I35: ен Я | J35: юатупс | K35: ― Я не | L35: спутаю | N35: их ни с гарпиями, ни | O35: Дмитрий Емец. Таня Гроттер и магический контрабас (2002) | P35: Дмитрий Емец | Q35: 1974 | R35: Таня Гроттер и магический контрабас | S35: художественная | T35: роман | V35: Дмитрий Емец. Таня Гроттер и магический контрабас | W35: 2002 | X35: книга | Y35: омонимия не снята
A36: NA | B36: неодушевлённый конкретный объект | C36: одушевлённый конкретный субъект | D36: 2 л., ед.ч. | E36: прош | F36: с | G36: 1966-1970 | H36: =RAND() -> 9.5052546106376479E-2 | I36: ыт обил 2 V 61 | J36: алатупс | K36: 16/V ― № 2; либо ты | L36: спутала | N36: нумерацию, либо четыре письма потерялись | O36: Юлий Даниэль. Письма из заключения (1966-1970) | P36: Юлий Даниэль | Q36: 1925 | R36: Письма из заключения | S36: бытовая , нехудожественная | T36: письмо личное | U36: частная жизнь | V36: Юлий Даниэль. «Я всё сбиваюсь на литературу…» Письма из заключения. Стихи | W36: 2000 | X36: книга | Y36: омонимия не снята
A37: NA | B37: абстрактный объект | C37: одушевлённый конкретный субъект | D37: 3 л., ед.ч. | E37: прош | F37: с | G37: 1968 | H37: =RAND() -> 0.70649558222327435 | I37: но локорп нидо окьлоТ | J37: латупс | K37: ― Только один прокол ― он | L37: спутал | N37: пол ребенка. | O37: Юлиан Семенов. Семнадцать мгновений весны (1968) | P37: Юлиан Семенов | Q37: 1931 | R37: Семнадцать мгновений весны | S37: художественная | T37: роман | X37: книга | Y37: омонимия не снята
A38: NA | B38: абстрактный объект | C38: абстрактный субъект | D38: 3 л., мн.ч. | E38: прош | F38: с | G38: 2008 | H38: =RAND() -> 0.41449012034504573 | I38: и илибс ёсв еыроток автсьлетяотсбо | J38: илатупс | K38: обстоятельства, которые всё «сбили и | L38: спутали | M38: », | N38: как пишет об этом Михаил | O38: Е. Душечкина, Л. Берсенева. Три века русской ёлки // «Наука и жизнь», 2008 | P38: Е. Душечкина, Л. Берсенева | R38: Три века русской ёлки | S38: публицистика , нехудожественная | T38: статья | U38: история | V38: «Наука и жизнь» | W38: 2008 | X38: журнал | Y38: омонимия не снята
A39: NA | B39: абстрактный объект | C39: NA | D39: NA., ед.ч. | E39: прош | F39: с | G39: 2007 | H39: =RAND() -> 0.50693620022624586 | I39: есв лешан ен уксипаз яиненлов | J39: латупс | K39: волнения записку не нашел, все | L39: спутал | N39: и опозорился. | O39: Михаил Гиголашвили. Чертово колесо (2007) | P39: Михаил Гиголашвили | Q39: 1954 | R39: Чертово колесо | S39: художественная | T39: роман | V39: М. Гиголашвили. Чертово колесо | W39: 2009 | X39: книга | Y39: омонимия не снята
A40: NA | B40: NA | C40: NA | D40: 2 л., ед.ч. | E40: буд | F40: с | G40: 2004 | H40: =RAND() -> 0.12075539235288812 | I40: ен отч аз ин хИ | J40: ьшеатупс | K40: Их ни за что не | L40: спутаешь | N40: благодаря фамильным чертам в передней | O40: Владимир Соловьев. Наслаждаясь открытым небом (2004) // «За рулем», 2004.03.15 | P40: Владимир Соловьев | R40: Наслаждаясь открытым небом | S40: публицистика , нехудожественная | T40: статья | U40: техника | V40: «За рулем» | W40: 2004.03.15 | X40: журнал | Y40: омонимия не снята
A41: одушевлённый конкретный объект | B41: NA | C41: NA | D41: 2 л., ед.ч. | E41: буд | F41: с | G41: 1999 | H41: =RAND() -> 0.50413819766077617 | I41: ен ежот монамьлепиЦ мосепоМ с | J41: ьшеатупс | K41: с Мопесом Ципельманом тоже не | L41: спутаешь | M41: . | O41: Андрей Белянин. Свирепый ландграф (1999) | P41: Андрей Белянин | Q41: 1967 | R41: Свирепый ландграф | S41: художественная | T41: роман | V41: Андрей Белянин. Свирепый ландграф | W41: 1999 | X41: книга | Y41: омонимия не снята
A42: NA | B42: NA | C42: NA | D42: NA, ед.ч. | E42: прош | F42: с | G42: 1950-1960 | H42: =RAND() -> 0.86875236599307248 | I42: меьневбаз отч или онлопен и | J42: латупс | K42: и неполно или что забвеньем | L42: спутал | M42: , | N42: и ты, земляк мой, архангельский | O42: Б. В. Шергин. От автора. Запечатленная слава (1950-1960) | P42: Б. В. Шергин | Q42: 1893 | R42: От автора. Запечатленная слава | S42: художественная | T42: очерк | V42: Борис Шергин. Повести и рассказы | W42: 1987 | X42: книга | Y42: омонимия не снята
A43: абстрактный объект | B43: NA | C43: NA | D43: 3 л., мн.ч. | E43: буд | F43: с | G43: 1980-1993 | H43: =RAND() -> 0.48024567365800386 | I43: оньлетазябО тежюс еокат отч тужакс | J43: тюатупс | K43: скажут, что такое сюжет. Обязательно | L43: спутают | N43: с фабулой. Писатели всегда путают | O43: Юрий Коваль. Веселье сердечное (1980-1993) | P43: Юрий Коваль | Q43: 1938 | R43: Веселье сердечное | S43: художественная | T43: рассказ | V43: Юрий Коваль. Опасайтесь лысых и усатых | W43: 1993 | X43: книга | Y43: омонимия не снята
A44: абстрактный объект | B44: абстрактный объект | C44: одушевлённый конкретный субъект | D44: 3 л., мн.ч. | E44: прош | F44: с | G44: 1970-1974 | H44: =RAND() -> 0.76859206010432679 | I44: авонамхА и вохаН | J44: илатупс | K44: Нахов и Ахманова | L44: спутали | N44: class и classic. | O44: В. В. Бибихин. Алексей Федорович Лосев. Записи 1970-1973 (1970-1974) | P44: В. В. Бибихин | Q44: 1938 | R44: Алексей Федорович Лосев. Записи 1970-1973 | S44: учебно-научная, нехудожественная | T44: дневник, записные книжки | V44: В. В. Бибихин. Алексей Федорович Лосев. Сергей Сергеевич Аверинцев | W44: 2006 | X44: книга | Y44: омонимия не снята
A45: одушевлённый конкретный объект | B45: одушевлённый конкретный объект | C45: NA | D45: NA, ед.ч. | E45: прош | F45: с | G45: 1963-1965 | H45: =RAND() -> 0.80415015777731202 | I45: окьлоТ иизанмиг ароткерид аныс ушаС | J45: алатупс | K45: Сашу, сына директора гимназии. Только | L45: спутала | N45: сначала маму с Аней. Две | O45: З. И. Воскресенская. Сердце матери (1963-1965) | P45: З. И. Воскресенская | Q45: 1907 | R45: Сердце матери | S45: художественная | T45: повесть | V45: Воскресенская З. И. Сердце матери | W45: 1986 | X45: книга | Y45: омонимия не снята
A46: одушевлённый конкретный объект | B46: одушевлённый конкретный объект | C46: NA | D46: NA, мн.ч. | E46: прош | F46: с | G46: 2000 | H46: =RAND() -> 0.663276754841575 | I46: амиТ ясливиду гом ен какин | J46: илатупС | K46: никак не мог, ― удивился Тима. ― | L46: Спутали | N46: меня с кем-то, наверное». Действительно | O46: Лев Дворецкий. Шакалы (2000) | P46: Лев Дворецкий | Q46: 1927 | R46: Шакалы | S46: художественная | T46: роман | V46: Лев Дворецкий. Шакалы | W46: 2000 | X46: книга | Y46: омонимия не снята
A47: NA | B47: абстрактный объект | C47: абстрактный субъект | D47: 3л., ед.ч. | E47: прош | F47: с | G47: 1958 | H47: =RAND() -> 0.91445303593942318 | I47: отэ ондо ежу и ьтижолто | J47: олатупс | K47: отложить, — и уже одно это | L47: спутало | N47: все планы уборочной. | O47: Федор Абрамов. Братья и сестры (1958) | P47: Федор Абрамов | Q47: 1920 | R47: Братья и сестры | S47: художественная | T47: роман | V47: Ф. Абрамов. Братья и сестры | W47: 1982 | X47: книга | Y47: омонимия не снята
A48: неодушевлённый конкретный объект | B48: неодушевлённый конкретный объект | C48: NA | D48: NA, мн.ч. | E48: прош | F48: с | G48: 1984 | H48: =RAND() -> 0.2838149945405446 | I48: ямерв еоротокен зереч а ялбмасна | J48: илатупс | K48: ансамбля, а через некоторое время | L48: спутали | N48: подлинный с купленным и не | O48: Д. С. Лихачев. Заметки о русском (1984) | P48: Д. С. Лихачев | Q48: 1906 | R48: Заметки о русском | S48: учебно-научная , нехудожественная | T48: статья | U48: наука и технологии, культурология | V48: Лихачев Д. С. Избранные работы в трех томах. Том 2 | W48: 1987 | X48: книга | Y48: омонимия не снята
A49: одушевлённый конкретный объект | B49: одушевлённый конкретный объект | C49: одушевлённый конкретный субъект | D49: 3 л., ед.ч. | E49: прош | F49: с | G49: 1987-2000 | H49: =RAND() -> 0.76796215309461435 | I49: акбаБ | J49: алатупс | K49: Бабка | L49: спутала | N49: Антона с Николаем Леонидовичем, своим | O49: Александр Чудаков. Ложится мгла на старые ступени (1987-2000) // «Знамя», 2000 | P49: Александр Чудаков | Q49: 1938 | R49: Ложится мгла на старые ступени | S49: художественная | T49: роман | V49: «Знамя» | W49: 2000 | X49: журнал | Y49: омонимия не снята
A50: одушевлённый конкретный объект | B50: одушевлённый конкретный объект | C50: NA | D50: 2 л., ед.ч. | E50: буд | F50: с | G50: 2007 | H50: =RAND() -> 0.96365053781749666 | I50: ен оге отч каТ | J50: ьшеатупс | K50: Так что его не | L50: спутаешь | N50: ни с кем. | O50: Евгений Сухов. Делу конец -- сроку начало (2007) | P50: Евгений Сухов | Q50: 1959 | R50: Делу конец -- сроку начало | S50: художественная | T50: роман | V50: Е. Е. Сухов. Делу конец -- сроку начало | W50: 2007 | X50: книга | Y50: омонимия не снята
A51: абстрактный объект | B51: абстрактный объект | C51: NA | D51: 2 л., ед.ч. | E51: буд | F51: с | G51: 2009 | H51: =RAND() -> 0.14077526293853637 | I51: ен ежу ее юлварт юущяотсан | J51: ьшеатупс | K51: настоящую травлю, ее уже не | L51: спутаешь | N51: ни с чем. | O51: Мариам Петросян. Дом, в котором... (2009) | P51: Мариам Петросян | Q51: 1969 | R51: Дом, в котором... | S51: художественная | T51: роман | V51: Мариам Петросян. Дом, в котором… | W51: 2009 | X51: книга | Y51: омонимия не снята | Z51: Когда увидишь настоящую травлю, ее уже не спутаешь ни с чем. [Мариам Петросян. Дом, в котором... (2009)] [омонимия не снята]

Sheet: 3.1 (а)
A3: Количество по полю PREFIX | B3: Названия столбцов
A4: Названия строк | B4: буд | C4: прош | D4: наст | E4: Общий итог
A5: пере | B5: 2 | C5: 23 | E5: 25
A6: с | B6: 8 | C6: 17 | E6: 25
A7: наст
A8: Общий итог | B8: 10 | C8: 40 | E8: 50

Sheet: 3.1 (б)
A3: Количество по полю PREFIX | B3: Названия столбцов
A4: Названия строк | B4: 1 л., ед.ч. | C4: 1 л., мн.ч. | D4: 2 л., ед.ч. | E4: 2 л., мн.ч. | F4: 3 л., ед.ч. | G4: 3 л., мн.ч. | H4: 3л., ед.ч. | I4: NA, ед.ч. | J4: NA, мн.ч. | K4: NA., ед.ч. | L4: (пусто) | M4: Общий итог
A5: пере | E5: 3 | F5: 13 | G5: 2 | I5: 5 | J5: 2 | M5: 25
A6: с | B6: 1 | C6: 1 | D6: 6 | F6: 7 | G6: 3 | H6: 1 | I6: 3 | J6: 2 | K6: 1 | M6: 25
A7: (пусто)
A8: Общий итог | B8: 1 | C8: 1 | D8: 6 | E8: 3 | F8: 20 | G8: 5 | H8: 1 | I8: 8 | J8: 4 | K8: 1 | M8: 50

Sheet: 3.1 (в)
A3: Количество по полю PERSONNUMBER | B3: Названия столбцов
B4: буд | H4: буд Итог | I4: прош | Q4: прош Итог | R4: (пусто) | S4: (пусто) Итог | T4: Общий итог
A5: Названия строк | B5: 1 л., ед.ч. | C5: 1 л., мн.ч. | D5: 2 л., ед.ч. | E5: 3 л., ед.ч. | F5: 3 л., мн.ч. | G5: NA, ед.ч. | I5: 2 л., ед.ч. | J5: 2 л., мн.ч. | K5: 3 л., ед.ч. | L5: 3 л., мн.ч. | M5: 3л., ед.ч. | N5: NA, ед.ч. | O5: NA, мн.ч. | P5: NA., ед.ч. | R5: (пусто)
A6: пере | E6: 1 | G6: 1 | H6: 2 | J6: 3 | K6: 12 | L6: 2 | N6: 4 | O6: 2 | Q6: 23 | T6: 25
A7: с | B7: 1 | C7: 1 | D7: 5 | F7: 1 | H7: 8 | I7: 1 | K7: 7 | L7: 2 | M7: 1 | N7: 3 | O7: 2 | P7: 1 | Q7: 17 | T7: 25
A8: (пусто)
A9: Общий итог | B9: 1 | C9: 1 | D9: 5 | E9: 1 | F9: 1 | G9: 1 | H9: 10 | I9: 1 | J9: 3 | K9: 19 | L9: 4 | M9: 1 | N9: 7 | O9: 4 | P9: 1 | Q9: 40 | T9: 50

Sheet: 3.2 (а)
A3: Количество по полю PARTICIPANT1 | B3: Названия столбцов
A4: Названия строк | B4: NA | C4: абстрактный субъект | D4: одушевлённый конкретный субъект | E4: Общий итог
A5: пере | B5: 8 | C5: 2 | D5: 15 | E5: 25
A6: с | B6: 12 | C6: 4 | D6: 9 | E6: 25
A7: Общий итог | B7: 20 | C7: 6 | D7: 24 | E7: 50

Sheet: 3.2 (б)
A3: Количество по полю PARTICIPANT2 | B3: Названия столбцов
A4: Названия строк | B4: NA | C4: абстрактный объект | D4: неодушевлённый конкретный объект | E4: одушевлённый конкретный объект | F4: (пусто) | G4: Общий итог
A5: пере | B5: 2 | C5: 15 | D5: 7 | E5: 1 | G5: 25
A6: с | B6: 9 | C6: 6 | D6: 4 | E6: 6 | G6: 25
A7: (пусто)
A8: Общий итог | B8: 11 | C8: 21 | D8: 11 | E8: 7 | G8: 50

Sheet: 3.3
A3: Количество по полю ГОД СОЗДАНИЯ | B3: Названия столбцов
A4: Названия строк | B4: 1940-1954 | C4: 1950-1960 | D4: 1958 | E4: 1960 | F4: 1963-1965 | G4: 1966-1970 | H4: 1968 | I4: 1970-1974 | J4: 1971-1975 | K4: 1973 | L4: 1974 | M4: 1975-1977 | N4: 1978 | O4: 1978-1995 | P4: 1979 | Q4: 1980-1993 | R4: 1983 | S4: 1984 | T4: 1987-2000 | U4: 1988-1998 | V4: 1989 | W4: 1995 | X4: 1996 | Y4: 1997 | Z4: 1999 | AA4: 2000 | AB4: 2001 | AC4: 2002 | AD4: 2002-2004 | AE4: 2004 | AF4: 2005 | AG4: 2007 | AH4: 2008 | AI4: 2008.10.13 | AJ4: 2008-2009 | AK4: 2009 | AL4: 2010 | AM4: 2011 | AN4: 2012 | AO4: (пусто) | AP4: Общий итог
A5: пере | E5: 1 | K5: 1 | L5: 1 | N5: 2 | O5: 1 | P5: 1 | R5: 1 | U5: 1 | W5: 1 | X5: 2 | Y5: 1 | Z5: 1 | AC5: 1 | AE5: 1 | AF5: 1 | AG5: 2 | AI5: 1 | AK5: 1 | AL5: 1 | AM5: 1 | AN5: 2 | AP5: 25
A6: с | B6: 1 | C6: 1 | D6: 1 | F6: 1 | G6: 1 | H6: 1 | I6: 1 | J6: 1 | M6: 1 | Q6: 1 | S6: 1 | T6: 1 | V6: 1 | Z6: 1 | AA6: 1 | AB6: 1 | AC6: 2 | AD6: 1 | AE6: 1 | AG6: 2 | AH6: 1 | AJ6: 1 | AK6: 1 | AP6: 25
A7: (пусто)
A8: Общий итог | B8: 1 | C8: 1 | D8: 1 | E8: 1 | F8: 1 | G8: 1 | H8: 1 | I8: 1 | J8: 1 | K8: 1 | L8: 1 | M8: 1 | N8: 2 | O8: 1 | P8: 1 | Q8: 1 | R8: 1 | S8: 1 | T8: 1 | U8: 1 | V8: 1 | W8: 1 | X8: 2 | Y8: 1 | Z8: 2 | AA8: 1 | AB8: 1 | AC8: 3 | AD8: 1 | AE8: 2 | AF8: 1 | AG8: 4 | AH8: 1 | AI8: 1 | AJ8: 1 | AK8: 2 | AL8: 1 | AM8: 1 | AN8: 2 | AP8: 50